{
  "schema_version": "1.0.0",
  "as_of": "2026-09-26",
  "meaning": "Аудит доступа и пределов доказательства. page_text — получен текст страницы (возможен ограниченный фрагмент); indexed_excerpt — доступен поисковый текст; metadata_only — найдены реквизиты; unavailable — содержимое не прочитано. Никакой статус доступа сам по себе не означает подтверждение действующего права. trace_files — идентификаторы внутренних поисковых сеансов; доступные выбранные фрагменты поставляются как хешированные snapshots.",
  "entries": [
    {
      "source_id": "SRC_LAW115",
      "access": "unavailable",
      "authority": "federal_authority",
      "temporal_limit": "Консолидированный акт: полная редакция на 26.09.2026 не получена; старые редакции нельзя применять без поправок 2026 года.",
      "permitted_use": "Исследовательская ссылка с указанными ограничениями; не основание для автоматической публикации маршрута.",
      "trace_files": [
        "web03.txt"
      ]
    },
    {
      "source_id": "SRC_LAW109",
      "access": "indexed_excerpt",
      "authority": "federal_authority",
      "temporal_limit": "Доступны индексированные положения; проверить поправки и эксперимент по 121-ФЗ.",
      "permitted_use": "Исследовательская ссылка с указанными ограничениями; не основание для автоматической публикации маршрута.",
      "trace_files": [
        "web04.txt",
        "web05.txt",
        "web26.txt"
      ]
    },
    {
      "source_id": "SRC_LAW114",
      "access": "indexed_excerpt",
      "authority": "federal_authority",
      "temporal_limit": "Часть акта; исключения и действующая редакция требуют полной сверки.",
      "permitted_use": "Исследовательская ссылка с указанными ограничениями; не основание для автоматической публикации маршрута.",
      "trace_files": [
        "web33.txt"
      ]
    },
    {
      "source_id": "SRC_ENTRY_TABLE",
      "access": "page_text",
      "authority": "federal_authority",
      "temporal_limit": "Безвизовый краткий визит не равнозначен праву на длительное обучение. Проверять конкретную строку страны и цель поездки.",
      "permitted_use": "Исследовательская ссылка с указанными ограничениями; не основание для автоматической публикации маршрута.",
      "trace_files": [
        "web14.txt"
      ]
    },
    {
      "source_id": "SRC_VISA",
      "access": "page_text",
      "authority": "federal_authority",
      "temporal_limit": "Общая консульская информация; конкретный комплект и сбор сверяются по консульскому округу.",
      "permitted_use": "Исследовательская ссылка с указанными ограничениями; не основание для автоматической публикации маршрута.",
      "trace_files": [
        "web09.txt",
        "web13.txt"
      ]
    },
    {
      "source_id": "SRC_INVITATION",
      "access": "indexed_excerpt",
      "authority": "state_operator",
      "temporal_limit": "Публикация формы не заменяет актуальный регламент выдачи приглашений.",
      "permitted_use": "Исследовательская ссылка с указанными ограничениями; не основание для автоматической публикации маршрута.",
      "trace_files": [
        "web34.txt"
      ]
    },
    {
      "source_id": "SRC_VISA907",
      "access": "indexed_excerpt",
      "authority": "state_operator",
      "temporal_limit": "На странице указана редакция 15.11.2022. Срок подачи на продление учебной визы — за 20 рабочих дней; актуальность остальных условий проверить.",
      "permitted_use": "Подтверждение только указанных в field evidence полей; непроверенные исключения и редакции остаются в unresolved.",
      "trace_files": [
        "web32.txt",
        "web34.txt"
      ]
    },
    {
      "source_id": "SRC_CARD",
      "access": "page_text",
      "authority": "federal_authority",
      "temporal_limit": "Страница использует устаревшее название ФМС. Содержание сверять с постановлением № 413 и действующими полномочиями МВД.",
      "permitted_use": "Исследовательская ссылка с указанными ограничениями; не основание для автоматической публикации маршрута.",
      "trace_files": [
        "web14.txt",
        "web33.txt"
      ]
    },
    {
      "source_id": "SRC_REG9",
      "access": "indexed_excerpt",
      "authority": "state_operator",
      "temporal_limit": "Указана редакция 26.01.2026, с 27.01.2026. Доступны индексированные фрагменты, не весь акт.",
      "permitted_use": "Исследовательская ссылка с указанными ограничениями; не основание для автоматической публикации маршрута.",
      "trace_files": [
        "web33.txt",
        "web34.txt"
      ]
    },
    {
      "source_id": "SRC_REG_GUIDE",
      "access": "indexed_excerpt",
      "authority": "federal_authority",
      "temporal_limit": "Разъяснение 2024 года: общий семидневный рабочий срок, не учитывает позднейшие эксперименты.",
      "permitted_use": "Исследовательская ссылка с указанными ограничениями; не основание для автоматической публикации маршрута.",
      "trace_files": [
        "web07.txt"
      ]
    },
    {
      "source_id": "SRC_STAY",
      "access": "indexed_excerpt",
      "authority": "state_operator",
      "temporal_limit": "Подтверждает общий лимит безвизового пребывания 90 суток суммарно в календарном году с 01.01.2025. Учебное продление — самостоятельное основание.",
      "permitted_use": "Исследовательская ссылка с указанными ограничениями; не основание для автоматической публикации маршрута.",
      "trace_files": [
        "web34.txt",
        "web40.txt"
      ]
    },
    {
      "source_id": "SRC_STUDENT_EXTEND",
      "access": "indexed_excerpt",
      "authority": "federal_authority",
      "temporal_limit": "Разъяснение 2022 года: ходатайство не позднее чем за 20 дней; уведомление о прекращении/завершении обучения — 3 рабочих дня. Требует сверки статьи 17.",
      "permitted_use": "Исследовательская ссылка с указанными ограничениями; не основание для автоматической публикации маршрута.",
      "trace_files": [
        "web15.txt"
      ]
    },
    {
      "source_id": "SRC_RUID",
      "access": "indexed_excerpt",
      "authority": "federal_authority",
      "temporal_limit": "Материал первоначального эксперимента: 72 часа, экстренные случаи 4 часа. Обязательность и последствия после 30.06.2026 требуют сверки постановления № 468.",
      "permitted_use": "Исследовательская ссылка с указанными ограничениями; не основание для автоматической публикации маршрута.",
      "trace_files": [
        "web11.txt"
      ]
    },
    {
      "source_id": "SRC_RUID468",
      "access": "metadata_only",
      "authority": "official_legal_publication",
      "temporal_limit": "Обнаружена публикация поправок к эксперименту № 1510; полный текст не получен. Продление до 31.12.2027 — предмет обязательной проверки первоисточника.",
      "permitted_use": "Исследовательская ссылка с указанными ограничениями; не основание для автоматической публикации маршрута.",
      "trace_files": [
        "web04.txt"
      ]
    },
    {
      "source_id": "SRC_BORDER_BIO",
      "access": "unavailable",
      "authority": "federal_authority",
      "temporal_limit": "Первоначальные пункты пропуска и исключения; территория и сроки меняются постановлениями.",
      "permitted_use": "Исследовательская ссылка с указанными ограничениями; не основание для автоматической публикации маршрута.",
      "trace_files": []
    },
    {
      "source_id": "SRC_AMINA121",
      "access": "indexed_excerpt",
      "authority": "federal_authority",
      "temporal_limit": "Индексированы этапы эксперимента 2025–2029; полнота исключений и реализация второго этапа с 01.09.2026 не подтверждены.",
      "permitted_use": "Исследовательская ссылка с указанными ограничениями; не основание для автоматической публикации маршрута.",
      "trace_files": [
        "web01.txt",
        "web02.txt"
      ]
    },
    {
      "source_id": "SRC_AMINA_MVD",
      "access": "indexed_excerpt",
      "authority": "federal_authority",
      "temporal_limit": "Социальная публикация ведомства — вспомогательное разъяснение; требуется подтверждение на основном сайте и текстом закона.",
      "permitted_use": "Исследовательская ссылка с указанными ограничениями; не основание для автоматической публикации маршрута.",
      "trace_files": [
        "web11.txt"
      ]
    },
    {
      "source_id": "SRC_MED2026",
      "access": "page_text",
      "authority": "federal_authority",
      "temporal_limit": "Прочитан текст разъяснения 162-ФЗ от 10.06.2026; точные исключения и переходные положения в статье не перечислены.",
      "permitted_use": "Подтверждение только указанных в field evidence полей; непроверенные исключения и редакции остаются в unresolved.",
      "trace_files": [
        "web07.txt",
        "web08.txt",
        "web09.txt",
        "web13.txt",
        "web14.txt",
        "web36.txt"
      ]
    },
    {
      "source_id": "SRC_MED2026_2",
      "access": "indexed_excerpt",
      "authority": "federal_authority",
      "temporal_limit": "Независимое официальное разъяснение поправок 2026 года; не заменяет полный текст 162-ФЗ.",
      "permitted_use": "Исследовательская ссылка с указанными ограничениями; не основание для автоматической публикации маршрута.",
      "trace_files": [
        "web12.txt"
      ]
    },
    {
      "source_id": "SRC_MED_SUBMIT",
      "access": "metadata_only",
      "authority": "official_legal_publication",
      "temporal_limit": "Исторический порядок; совместимость с электронными заключениями с 01.09.2026 не установлена.",
      "permitted_use": "Исследовательская ссылка с указанными ограничениями; не основание для автоматической публикации маршрута.",
      "trace_files": [
        "web30.txt"
      ]
    },
    {
      "source_id": "SRC_FINGERPRINT",
      "access": "indexed_excerpt",
      "authority": "federal_authority",